{
  "$schema": "http://json-schema.org/draft-04/schema#",
  "id": "record-links.json#",
  "title": "Schema for the record links data file: how two records of any types relate, read both ways (see docs/data-model.md)",
  "type": "object",
  "definitions": {},
  "properties": {
    "from_type": {
      "description": "The collection of the record the link is from.",
      "$ref": "definitions.json#/definitions/content_type"
    },
    "from_id": {
      "description": "The record's id in that collection.",
      "$ref": "definitions.json#/definitions/uuid"
    },
    "to_type": {
      "description": "The collection of the record the link is to.",
      "$ref": "definitions.json#/definitions/content_type"
    },
    "to_id": {
      "description": "The record's id in that collection.",
      "$ref": "definitions.json#/definitions/uuid"
    },
    "relation": {
      "description": "How the from record relates to the to record. figure-of: the miniature stands for the deployment card or hero. form-of: the form card is a form of the deployment card. elite-of: the elite deployment card is the elite version of the regular one. campaign-of: the Campaign-only deployment card is the campaign version of the Skirmish-only one. document-for: the document was published for the source (not in its box). requires: the record can only be played with the source. expands: the record adds to the source.",
      "enum": [
        "figure-of",
        "form-of",
        "elite-of",
        "campaign-of",
        "document-for",
        "requires",
        "expands"
      ]
    },
    "reverse_relation": {
      "description": "The same link read from the to record: has-figure, has-form, regular-of, skirmish-of, has-document, required-by, expanded-by.",
      "enum": [
        "has-figure",
        "has-form",
        "regular-of",
        "skirmish-of",
        "has-document",
        "required-by",
        "expanded-by"
      ]
    }
  },
  "required": [
    "from_type",
    "from_id",
    "to_type",
    "to_id",
    "relation",
    "reverse_relation"
  ],
  "oneOf": [
    {
      "description": "A miniature and the deployment cards and hero it stands for.",
      "properties": {
        "relation": {"enum": ["figure-of"]},
        "reverse_relation": {"enum": ["has-figure"]},
        "from_type": {"enum": ["miniatures"]},
        "to_type": {"enum": ["deployment-cards", "heroes"]}
      }
    },
    {
      "description": "A form card and the deployment cards it's a form of.",
      "properties": {
        "relation": {"enum": ["form-of"]},
        "reverse_relation": {"enum": ["has-form"]},
        "from_type": {"enum": ["form-cards"]},
        "to_type": {"enum": ["deployment-cards"]}
      }
    },
    {
      "description": "An elite deployment card and the regular card of the same name.",
      "properties": {
        "relation": {"enum": ["elite-of"]},
        "reverse_relation": {"enum": ["regular-of"]},
        "from_type": {"enum": ["deployment-cards"]},
        "to_type": {"enum": ["deployment-cards"]}
      }
    },
    {
      "description": "A Campaign-only deployment card and its Skirmish-only twin.",
      "properties": {
        "relation": {"enum": ["campaign-of"]},
        "reverse_relation": {"enum": ["skirmish-of"]},
        "from_type": {"enum": ["deployment-cards"]},
        "to_type": {"enum": ["deployment-cards"]}
      }
    },
    {
      "description": "A document published for a source, but not in its box.",
      "properties": {
        "relation": {"enum": ["document-for"]},
        "reverse_relation": {"enum": ["has-document"]},
        "from_type": {"enum": ["documents"]},
        "to_type": {"enum": ["sources"]}
      }
    },
    {
      "description": "A record (a product, a mission, ...) that can only be played with a source.",
      "properties": {
        "relation": {"enum": ["requires"]},
        "reverse_relation": {"enum": ["required-by"]},
        "to_type": {"enum": ["sources"]}
      }
    },
    {
      "description": "A record that adds to a source.",
      "properties": {
        "relation": {"enum": ["expands"]},
        "reverse_relation": {"enum": ["expanded-by"]},
        "to_type": {"enum": ["sources"]}
      }
    }
  ],
  "additionalProperties": false
}